{
  "$schema": "./schemas/poesis-platform.schema.json",
  "solutions": [
    {
      "slug": "oip",
      "name": "OIP",
      "fullName": "Organizational Intelligence Platform",
      "tags": [
        "Domain Intelligence Platform"
      ],
      "excerpt": "A planned IT workspace for shared definitions, evidence review, scoped appraisal and generation.",
      "tagline": "The Organizational Intelligence Platform: a shared, governed account of the IT landscape, with planned analysis, appraisal, sourcing and generation.",
      "description": "An authenticated shell and account foundations exist. Domain workflows, scoped policy enforcement and integrated SIE access remain planned; hosted availability is not established.",
      "qualities": [
        "accepted-intent",
        "inspected-revision",
        "observed-deployment"
      ],
      "capabilities": [
        {
          "slug": "governed-it-inventory",
          "name": "Governed IT definition inventory",
          "blurb": "Maintain a shared IT inventory whose typed definitions, review decisions and access responsibilities stay connected across framework views. Browser authoring, tenant/object policy and identity synchronization remain planned beyond the existing authentication foundations.",
          "state": "planned",
          "kind": "implementation",
          "features": [
            "web-application/definitions-management",
            "web-application/rbac-abac",
            "web-application/identity-provider-synchronization",
            "web-application/governance-review-sessions",
            "web-application/definitions-truth-sourcing-management"
          ]
        },
        {
          "slug": "it-governance-fabric-composition",
          "name": "IT governance fabric composition",
          "blurb": "Compose selected frameworks and internal obligations against a shared IT inventory, review overlaps and gaps, and retain revision-bound adoption decisions. Composition does not itself evaluate or enforce compliance.",
          "state": "planned",
          "kind": "implementation",
          "features": [
            "web-application/ontology-management",
            "web-application/definitions-management",
            "web-application/governance-review-sessions"
          ]
        },
        {
          "slug": "continuous-it-compliance-evaluation",
          "name": "Scoped IT compliance evaluation",
          "blurb": "Appraise scoped IT definitions, carry versioned findings into accountable corrective reviews, and reappraise revised proposals. Preserve applicability and unknown states; continuous live-system assurance additionally requires observations and scheduling.",
          "state": "planned",
          "kind": "implementation",
          "features": [
            "web-application/it-compliance-evaluation",
            "web-application/definitions-management",
            "web-application/governance-review-sessions"
          ]
        },
        {
          "slug": "model-grounded-it-reasoning",
          "name": "IT dependency analysis and decision support",
          "blurb": "Assess proposed IT changes by combining dependency and obligation paths with cited, read-only answers over authorized definitions. Planned analysis exposes missing boundaries and insufficient evidence; causal simulation additionally needs validated scenario dynamics and explicit uncertainty.",
          "state": "planned",
          "kind": "implementation",
          "features": [
            "web-application/it-impact-simulation",
            "web-application/it-copilot"
          ]
        },
        {
          "slug": "it-artifact-generation",
          "name": "IT artifact generation",
          "blurb": "Turn a selected IT baseline into consistent architecture and evidence document families, then review outputs against the definitions and decisions they cite. Recurring production retains pinned inputs and exposes incomplete jobs; generation is not substantive acceptance.",
          "state": "planned",
          "kind": "implementation",
          "features": [
            "web-application/it-artifact-factory",
            "web-application/definitions-management",
            "web-application/governance-review-sessions"
          ]
        }
      ],
      "products": [
        {
          "slug": "web-application",
          "name": "Web Application",
          "currentVersion": "0.1",
          "tagline": "Bring IT definitions, evidence and decisions into one shared workspace.",
          "description": "The authenticated application shell is available. Planned workflows connect inventory authoring, ontology composition, scoped appraisal, impact analysis and cited copilot answers through the BFF and SIE, with tenant/object access controls.",
          "qualities": [
            "authenticated-by-default",
            "role-and-attribute-access"
          ],
          "repos": [
            "oip-web-frontend"
          ],
          "features": [
            {
              "slug": "it-artifact-factory",
              "name": "IT artifact factory",
              "blurb": "Generate ADR packs, architecture baselines, roadmaps and evidence summaries from pinned definitions and versioned templates. Maintain and preview bindings, specify narrative grounding, schedule recurring runs and inspect partial or failed jobs; review substantive quality before accepting each document.",
              "state": "planned",
              "kind": "implementation",
              "milestone": {
                "version": "1.1",
                "label": "IT artifact factory"
              }
            },
            {
              "slug": "it-compliance-evaluation",
              "name": "IT compliance evaluation",
              "blurb": "Review scoped measures and findings with rule/input versions and explicit unknown or not-applicable results. Carry findings into owned corrective proposals and reappraise after change; live-system assessment additionally uses observation evidence.",
              "state": "planned",
              "kind": "implementation",
              "milestone": {
                "version": "1.3",
                "label": "IT compliance evaluation"
              }
            },
            {
              "slug": "it-copilot",
              "name": "IT Copilot",
              "blurb": "Ask read-only questions over authorized, versioned definitions and check answers through citations, snapshot age and explicit abstention when evidence is insufficient.",
              "state": "planned",
              "kind": "implementation",
              "milestone": {
                "version": "1.4",
                "label": "IT Copilot"
              }
            },
            {
              "slug": "it-impact-simulation",
              "name": "IT impact analysis and planned simulation",
              "blurb": "Trace dependency and obligation paths, including cycles, retirement prerequisites and missing boundaries. Causal simulation is a further extension with validated dynamics and explicit uncertainty; retirement execution is separate.",
              "state": "planned",
              "kind": "implementation",
              "milestone": {
                "version": "1.5",
                "label": "IT impact simulation"
              }
            },
            {
              "slug": "definitions-truth-sourcing-management",
              "name": "GSM Definitions sourcing management",
              "blurb": "Configure repository branches, paths and revision boundaries, set refresh expectations, track durable runs and coverage, recover incomplete collection, reconcile candidates and register reviewed drafts idempotently, with visible failures and source age.",
              "state": "planned",
              "kind": "implementation",
              "milestone": {
                "version": "1.2",
                "label": "Truth sourcing management"
              }
            },
            {
              "slug": "definitions-management",
              "name": "GSM Definitions management",
              "blurb": "Author and revise definitions through the browser, BFF and Definition Manager, with lifecycle commands, actionable validation and stale-write feedback. Save selection/traversal lenses, inspect one subject across framework views and carry corrected proposals into renewed review.",
              "state": "planned",
              "kind": "implementation",
              "milestone": {
                "version": "1.0",
                "label": "MVP/GA — GSM Definitions & Ontology management, RBAC/ABAC, hardened",
                "shipped": true,
                "ga": true
              }
            },
            {
              "slug": "ontology-management",
              "name": "GSM Ontology management",
              "blurb": "Import and reuse pinned package selections, bind adopter scope, compare coverage against an explicit subject/concern inventory, review competing obligations with accountable interpretation and govern upgrades. Selection does not establish legal completeness.",
              "state": "planned",
              "kind": "implementation",
              "milestone": {
                "version": "1.0",
                "label": "MVP/GA — GSM Definitions & Ontology management, RBAC/ABAC, hardened",
                "shipped": true,
                "ga": true
              }
            },
            {
              "slug": "rbac-abac",
              "name": "Authentication and planned RBAC/ABAC",
              "blurb": "Sign in and assign privileges today. Planned RBAC administration and ABAC will review and enforce tenant, object and action permissions against responsibilities.",
              "state": "partial",
              "kind": "implementation",
              "milestone": {
                "version": "1.0",
                "label": "MVP/GA — GSM Definitions & Ontology management, RBAC/ABAC, hardened",